{"bootstrap":{"confidence_level":0.95,"replicates":2000,"seed":20260724,"unit":"repository"},"contract_version":1,"counts":{"empty_strata":1,"identified_strata":18,"lines":656070,"not_identified_strata":1,"repositories":96,"strata":20},"horizons_days":[30,90,180,365],"invariants":{"all_aalen_johansen_masses_conserved":true,"all_kaplan_meier_curves_monotone":true,"all_risk_sets_explicit":true,"cursor_365_rise_absent":true},"selection_outcomes_consulted":false,"source":{"event_inventory_file":"survival-event-inventory.v1.json","event_inventory_sha256":"6a82bf7a2827a8d135d186ce1ef551e77de7d18de8f77224778a5110bb017213"},"strata":[{"dimensions":{},"estimate":{"bootstrap":{"confidence_level":0.95,"primary":{"aalen_johansen":[{"horizon_days":30.0,"states":{"deleted":{"lower":0.011834230651573534,"upper":0.05212422530360818},"modified":{"lower":0.012878917075239157,"upper":0.03524444669275119},"unchanged":{"lower":0.9222859132330196,"upper":0.9693995064846461}}},{"horizon_days":90.0,"states":{"deleted":{"lower":0.016493966231215237,"upper":0.0590585513392897},"modified":{"lower":0.022575681925869204,"upper":0.044954366747856966},"unchanged":{"lower":0.9047228252635257,"upper":0.9549633492038443}}},{"horizon_days":180.0,"states":{"deleted":{"lower":0.025390924488690448,"upper":0.08070520904985734},"modified":{"lower":0.030703624083094395,"upper":0.05721352122840262},"unchanged":{"lower":0.8738018373180998,"upper":0.9354293198115843}}},{"horizon_days":365.0,"states":{"deleted":{"lower":0.05563966137639973,"upper":0.14243473475345933},"modified":{"lower":0.04029622978928477,"upper":0.0688920666728038},"unchanged":{"lower":0.8041352362937138,"upper":0.8902763641188314}}}],"kaplan_meier":[{"horizon_days":30.0,"lower":0.9478977662057276,"upper":0.9881751502575943},{"horizon_days":90.0,"lower":0.9410105947983965,"upper":0.9835258812437949},{"horizon_days":180.0,"lower":0.9193384584670479,"upper":0.9746211469790079},{"horizon_days":365.0,"lower":0.8580854872218125,"upper":0.9443602158601987}]},"replicates":2000,"secondary":{"aalen_johansen":[{"horizon_days":30.0,"states":{"deleted":{"lower":0.022642469916172064,"upper":0.06298382064619863},"modified":{"lower":0.014519424009782188,"upper":0.07157103679216313},"unchanged":{"lower":0.8852057847067005,"upper":0.9592564240332722}}},{"horizon_days":90.0,"states":{"deleted":{"lower":0.026461030011631435,"upper":0.06826708412969724},"modified":{"lower":0.02181987570453624,"upper":0.07284550432251014},"unchanged":{"lower":0.8834491224064167,"upper":0.9460799743459117}}},{"horizon_days":180.0,"states":{"deleted":{"lower":0.036576992422274135,"upper":0.08299423282908129},"modified":{"lower":0.028884157466002633,"upper":0.07373753977870592},"unchanged":{"lower":0.8781228211878248,"upper":0.9253697894542675}}},{"horizon_days":365.0,"states":{"deleted":{"lower":0.0455740471437729,"upper":0.1328562814415088},"modified":{"lower":0.037122944297334544,"upper":0.0770019839663111},"unchanged":{"lower":0.8106959414691909,"upper":0.8846932096348423}}}],"kaplan_meier":[{"horizon_days":30.0,"lower":0.937036532239689,"upper":0.9773688721444023},{"horizon_days":90.0,"lower":0.9318422807070491,"upper":0.9735543054327234},{"horizon_days":180.0,"lower":0.9172165297599352,"upper":0.9635565049667598},{"horizon_days":365.0,"lower":0.8672762075078139,"upper":0.9545207500630654}]},"seed":20260724,"unit":"repository"},"estimator_version":2,"horizons_days":[30.0,90.0,180.0,365.0],"line_count":656070,"primary":{"aalen_johansen":[{"horizon_days":30.0,"risk_set_by_state":{"modified":{"lines":33979,"weight":1.9176126032143852},"unchanged":{"lines":507891,"weight":86.81841252675392}},"state_occupancy":{"deleted":0.03007251762651752,"modified":0.021504564124772477,"unchanged":0.9484229182487159}},{"horizon_days":90.0,"risk_set_by_state":{"modified":{"lines":34867,"weight":2.7031665592264003},"unchanged":{"lines":502904,"weight":83.6429775234327}},"state_occupancy":{"deleted":0.03603225080862756,"modified":0.03164170739632955,"unchanged":0.9323260417950499}},{"horizon_days":180.0,"risk_set_by_state":{"modified":{"lines":35973,"weight":3.4039298487551837},"unchanged":{"lines":496286,"weight":79.34385449447667}},"state_occupancy":{"deleted":0.05150979905216182,"modified":0.04198422539259774,"unchanged":0.9065059755552476}},{"horizon_days":365.0,"risk_set_by_state":{"modified":{"lines":32921,"weight":3.969107963320157},"unchanged":{"lines":434399,"weight":70.57298643459097}},"state_occupancy":{"deleted":0.09822417035348233,"modified":0.05238249955622467,"unchanged":0.8493933300902979}}],"kaplan_meier":[{"horizon_days":30.0,"risk_set_lines":541870,"risk_set_weight":88.73602512880106,"survival":0.9699383472242916},{"horizon_days":90.0,"risk_set_lines":537771,"risk_set_weight":86.34614408149591,"survival":0.9640078704720222},{"horizon_days":180.0,"risk_set_lines":532259,"risk_set_weight":82.7477843420807,"survival":0.9485582808535833},{"horizon_days":365.0,"risk_set_lines":467320,"risk_set_weight":74.54209439714462,"survival":0.9019705249700927}],"weighting":"repository"},"repository_count":96,"secondary":{"aalen_johansen":[{"horizon_days":30.0,"risk_set_by_state":{"modified":{"lines":33979,"weight":33979.0},"unchanged":{"lines":507891,"weight":507891.0}},"state_occupancy":{"deleted":0.04220461683846198,"modified":0.06372011546038957,"unchanged":0.8940752677011475}},{"horizon_days":90.0,"risk_set_by_state":{"modified":{"lines":34867,"weight":34867.0},"unchanged":{"lines":502904,"weight":502904.0}},"state_occupancy":{"deleted":0.043272314727166576,"modified":0.06611974653128551,"unchanged":0.8906079387415469}},{"horizon_days":180.0,"risk_set_by_state":{"modified":{"lines":35973,"weight":35973.0},"unchanged":{"lines":496286,"weight":496286.0}},"state_occupancy":{"deleted":0.04592816161374919,"modified":0.06850300160175121,"unchanged":0.8855688367844986}},{"horizon_days":365.0,"risk_set_by_state":{"modified":{"lines":32921,"weight":32921.0},"unchanged":{"lines":434399,"weight":434399.0}},"state_occupancy":{"deleted":0.05463297039107044,"modified":0.07267816106295634,"unchanged":0.8726888685459727}}],"kaplan_meier":[{"horizon_days":30.0,"risk_set_lines":541870,"risk_set_weight":541870.0,"survival":0.9578921830000149},{"horizon_days":90.0,"risk_set_lines":537771,"risk_set_weight":537771.0,"survival":0.9568347532764322},{"horizon_days":180.0,"risk_set_lines":532259,"risk_set_weight":532259.0,"survival":0.9541830487727241},{"horizon_days":365.0,"risk_set_lines":467320,"risk_set_weight":467320.0,"survival":0.9454668655341988}],"weighting":"line"}},"line_count":656070,"repository_count":96,"status":"identified","stratum_id":"overall"},{"dimensions":{"agent_family":"Claude_Code"},"estimate":{"bootstrap":{"confidence_level":0.95,"primary":{"aalen_johansen":[{"horizon_days":30.0,"states":{"deleted":{"lower":0.002522562581307663,"upper":0.07214872544510817},"modified":{"lower":0.0050632927431551325,"upper":0.0206736780843577},"unchanged":{"lower":0.9114338033327611,"upper":0.9914381828350054}}},{"horizon_days":90.0,"states":{"deleted":{"lower":0.002977168330459452,"upper":0.09139684803052546},"modified":{"lower":0.016139316559947877,"upper":0.05228847628702729},"unchanged":{"lower":0.8742058055974123,"upper":0.9725205797394484}}},{"horizon_days":180.0,"states":{"deleted":{"lower":0.00522233855974252,"upper":0.12000946906497795},"modified":{"lower":0.030940363887175616,"upper":0.11659608425832939},"unchanged":{"lower":0.8035097717306132,"upper":0.9439873568413245}}},{"horizon_days":365.0,"states":{"deleted":{"lower":0.01871507350553988,"upper":0.19833941687979406},"modified":{"lower":0.03519005145284462,"upper":0.13960640891802367},"unchanged":{"lower":0.7143864895523454,"upper":0.9116483785368787}}}],"kaplan_meier":[{"horizon_days":30.0,"lower":0.9278525538191352,"upper":0.9974774318043187},{"horizon_days":90.0,"lower":0.9086074557774082,"upper":0.9970231041008932},{"horizon_days":180.0,"lower":0.8805194559471865,"upper":0.9947759147118537},{"horizon_days":365.0,"lower":0.8023492414516059,"upper":0.9812837692415821}]},"replicates":2000,"secondary":{"aalen_johansen":[{"horizon_days":30.0,"states":{"deleted":{"lower":0.006630675618706993,"upper":0.13479190645690087},"modified":{"lower":0.009982313564191844,"upper":0.020561246967423907},"unchanged":{"lower":0.8478850649379802,"upper":0.9827175698338213}}},{"horizon_days":90.0,"states":{"deleted":{"lower":0.00672490477819759,"upper":0.16369638338927625},"modified":{"lower":0.01964014292596553,"upper":0.04623030301716484},"unchanged":{"lower":0.7991238967380867,"upper":0.9725065301372201}}},{"horizon_days":180.0,"states":{"deleted":{"lower":0.0077363280257590206,"upper":0.21322016239390815},"modified":{"lower":0.03142009792858682,"upper":0.07923763611460456},"unchanged":{"lower":0.7369469701754865,"upper":0.9533062786915673}}},{"horizon_days":365.0,"states":{"deleted":{"lower":0.019131168562844268,"upper":0.24190616289587075},"modified":{"lower":0.0323172725566268,"upper":0.10613427718395116},"unchanged":{"lower":0.7047477913691413,"upper":0.9438634353797031}}}],"kaplan_meier":[{"horizon_days":30.0,"lower":0.8652177272578053,"upper":0.9933694371663347},{"horizon_days":90.0,"lower":0.8363168111273781,"upper":0.9932752326918636},{"horizon_days":180.0,"lower":0.7875625342132752,"upper":0.9922593570294785},{"horizon_days":365.0,"lower":0.7589045208096172,"upper":0.9810010727860233}]},"seed":20260724,"unit":"repository"},"estimator_version":2,"horizons_days":[30.0,90.0,180.0,365.0],"line_count":38688,"primary":{"aalen_johansen":[{"horizon_days":30.0,"risk_set_by_state":{"modified":{"lines":586,"weight":0.1439648937324943},"unchanged":{"lines":35719,"weight":12.161326707283028}},"state_occupancy":{"deleted":0.02731736159142109,"modified":0.01190773962252028,"unchanged":0.9607748987860582}},{"horizon_days":90.0,"risk_set_by_state":{"modified":{"lines":1059,"weight":0.3853388254875022},"unchanged":{"lines":33674,"weight":11.306321190852959}},"state_occupancy":{"deleted":0.03837265288236737,"modifie